{
  "schema_version": "1.1",
  "id": "slice-live-probe-main",
  "goal_id": "understand-live-probe",
  "title": "存活探测主 I/O 路径",
  "question": "目标字符串如何变成存活结果？",
  "abstraction_level": "L2",
  "stage": "flow_traced",
  "observable_anchor": {
    "kind": "function",
    "description": "analyse(target)",
    "location": "probe.c"
  },
  "boundary": {
    "inside": [
      "analyse",
      "live_probe"
    ],
    "outside": [
      "caller",
      "network implementation"
    ]
  },
  "participants": [
    {
      "id": "analyse",
      "name": "analyse()",
      "kind": "function",
      "role": "接收上游目标并把存活判断委托给 live_probe()。",
      "input": {
        "producer": "caller",
        "type": "const char *",
        "meaning": "目标字符串"
      },
      "output": {
        "consumer": "caller",
        "type": "int",
        "meaning": "存活判断结果"
      },
      "source": {
        "path": "probe.c",
        "symbol": "analyse",
        "lines": "5-7"
      }
    },
    {
      "id": "live-probe",
      "name": "live_probe()",
      "kind": "function",
      "role": "消费目标字符串并产出当前样例中的存活布尔结果。",
      "input": {
        "producer": "analyse",
        "type": "const char *",
        "meaning": "目标字符串"
      },
      "output": {
        "consumer": "analyse",
        "type": "int",
        "meaning": "非空目标为真"
      },
      "source": {
        "path": "probe.c",
        "symbol": "live_probe",
        "lines": "1-3"
      }
    }
  ],
  "flow": {
    "nodes": [
      "analyse",
      "live-probe"
    ],
    "edges": [
      {
        "from": "analyse",
        "to": "live-probe",
        "relation": "calls",
        "data": "target"
      },
      {
        "from": "live-probe",
        "to": "analyse",
        "relation": "returns",
        "data": "int"
      }
    ]
  },
  "state_changes": [],
  "side_effects": [],
  "failure_paths": [],
  "introduced_entities": [
    {
      "id": "analyse",
      "name": "analyse()",
      "kind": "function",
      "role": "接收上游目标并把存活判断委托给 live_probe()。",
      "input": "target string",
      "action": "delegate probe",
      "output": "int result",
      "source": {
        "path": "probe.c",
        "symbol": "analyse"
      },
      "map": false
    },
    {
      "id": "live-probe",
      "name": "live_probe()",
      "kind": "function",
      "role": "消费目标字符串并产出当前样例中的存活布尔结果。",
      "input": "target string",
      "action": "check non-empty target",
      "output": "int result",
      "source": {
        "path": "probe.c",
        "symbol": "live_probe"
      },
      "map": true
    }
  ],
  "evidence_refs": [
    "round-live-probe-1-evidence-1"
  ],
  "unknown_refs": [
    "round-live-probe-1-unknown-1"
  ],
  "round_refs": [
    "round-live-probe-1"
  ],
  "checkpoint": {
    "id": "round-live-probe-1-checkpoint",
    "level": "L2",
    "difficulty": "current_level",
    "question": "哪个函数拥有从目标输入到存活结果的主要判断职责？",
    "expected_elements": [
      "live_probe()",
      "analyse() 只编排"
    ],
    "user_answer": "live_probe()，analyse() 负责委托。",
    "assessment": "passed",
    "feedback": "能够区分编排边界与具体处理者。"
  },
  "summary": "analyse 接收目标并调用 live_probe；live_probe 进行表示层面的存活判断并把 int 结果返回。",
  "atlas_node_id": "atlas-slice-slice-live-probe-main",
  "revision": {
    "branch": "master",
    "commit": "a8d4d8f2fb0b7a509855b510d5c9af5599391794",
    "dirty": true
  },
  "created_at": "2026-07-21T11:09:42.584Z",
  "updated_at": "2026-07-21T11:09:42.726Z"
}
